[
    {
        "durabilityCost":  2,
        "id":  "job-001",
        "repGainSuccess":  3,
        "staminaCost":  2,
        "tier":  1,
        "basePayout":  110,
        "requiredTools":  [
                              "hammer",
                              "screwdriver"
                          ],
        "name":  "Porch Rail Tighten",
        "risk":  0.18,
        "flavor":  {
                       "neutral_line":  "Porch Rail Tighten improved in the emotionally measurable ways.",
                       "success_line":  "Porch Rail Tighten no longer looks experimental.",
                       "client_quote":  "Can we make this railing less suspenseful?",
                       "fail_line":  "Porch Rail Tighten remains interpretive with structural ambition."
                   },
        "districtId":  "residential",
        "tags":  [
                     "outdoor",
                     "finish",
                     "painting"
                 ],
        "repLossFail":  1
    },
    {
        "durabilityCost":  2,
        "id":  "job-002",
        "repGainSuccess":  3,
        "staminaCost":  2,
        "tier":  1,
        "basePayout":  95,
        "requiredTools":  [
                              "hammer",
                              "level"
                          ],
        "name":  "Mailbox Post Reset",
        "risk":  0.16,
        "flavor":  {
                       "neutral_line":  "Mailbox Post Reset improved in the emotionally measurable ways.",
                       "success_line":  "Mailbox Post Reset no longer looks experimental.",
                       "client_quote":  "My mailbox leans like it has opinions.",
                       "fail_line":  "Mailbox Post Reset remains interpretive with structural ambition."
                   },
        "districtId":  "residential",
        "tags":  [
                     "outdoor",
                     "framing",
                     "concrete"
                 ],
        "repLossFail":  1
    },
    {
        "durabilityCost":  3,
        "id":  "job-003",
        "repGainSuccess":  4,
        "staminaCost":  2,
        "tier":  1,
        "basePayout":  125,
        "requiredTools":  [
                              "drill",
                              "level"
                          ],
        "name":  "Kitchen Shelf Mount",
        "risk":  0.2,
        "flavor":  {
                       "neutral_line":  "Kitchen Shelf Mount improved in the emotionally measurable ways.",
                       "success_line":  "Kitchen Shelf Mount no longer looks experimental.",
                       "client_quote":  "I would like gravity to stop winning.",
                       "fail_line":  "Kitchen Shelf Mount remains interpretive with structural ambition."
                   },
        "districtId":  "residential",
        "tags":  [
                     "finish",
                     "indoor"
                 ],
        "repLossFail":  1
    },
    {
        "durabilityCost":  2,
        "id":  "job-004",
        "repGainSuccess":  4,
        "staminaCost":  2,
        "tier":  1,
        "basePayout":  118,
        "requiredTools":  [
                              "wrench",
                              "screwdriver"
                          ],
        "name":  "Leaky Tap Trim",
        "risk":  0.22,
        "flavor":  {
                       "neutral_line":  "Leaky Tap Trim improved in the emotionally measurable ways.",
                       "success_line":  "Leaky Tap Trim no longer looks experimental.",
                       "client_quote":  "The sink keeps applauding at 2 AM.",
                       "fail_line":  "Leaky Tap Trim remains interpretive with structural ambition."
                   },
        "districtId":  "residential",
        "tags":  [
                     "plumbing",
                     "indoor"
                 ],
        "repLossFail":  1
    },
    {
        "durabilityCost":  3,
        "id":  "job-005",
        "repGainSuccess":  4,
        "staminaCost":  2,
        "tier":  1,
        "basePayout":  135,
        "requiredTools":  [
                              "hammer",
                              "saw"
                          ],
        "name":  "Fence Panel Patch",
        "risk":  0.25,
        "flavor":  {
                       "neutral_line":  "Fence Panel Patch improved in the emotionally measurable ways.",
                       "success_line":  "Fence Panel Patch no longer looks experimental.",
                       "client_quote":  "One fence plank has chosen freedom.",
                       "fail_line":  "Fence Panel Patch remains interpretive with structural ambition."
                   },
        "districtId":  "residential",
        "tags":  [
                     "outdoor",
                     "framing"
                 ],
        "repLossFail":  2
    },
    {
        "durabilityCost":  2,
        "id":  "job-006",
        "repGainSuccess":  3,
        "staminaCost":  2,
        "tier":  1,
        "basePayout":  105,
        "requiredTools":  [
                              "screwdriver",
                              "level"
                          ],
        "name":  "Closet Door Align",
        "risk":  0.14,
        "flavor":  {
                       "neutral_line":  "Closet Door Align improved in the emotionally measurable ways.",
                       "success_line":  "Closet Door Align no longer looks experimental.",
                       "client_quote":  "The closet door only closes during holidays.",
                       "fail_line":  "Closet Door Align remains interpretive with structural ambition."
                   },
        "districtId":  "residential",
        "tags":  [
                     "indoor",
                     "finish",
                     "drywall"
                 ],
        "repLossFail":  1
    },
    {
        "durabilityCost":  2,
        "id":  "job-007",
        "repGainSuccess":  3,
        "staminaCost":  2,
        "tier":  1,
        "basePayout":  112,
        "requiredTools":  [
                              "utility-knife",
                              "caulk-gun"
                          ],
        "name":  "Drywall Corner Rescue",
        "risk":  0.21,
        "flavor":  {
                       "neutral_line":  "Drywall Corner Rescue improved in the emotionally measurable ways.",
                       "success_line":  "Drywall Corner Rescue no longer looks experimental.",
                       "client_quote":  "This corner is trying very hard.",
                       "fail_line":  "Drywall Corner Rescue remains interpretive with structural ambition."
                   },
        "districtId":  "residential",
        "tags":  [
                     "indoor",
                     "finish"
                 ],
        "repLossFail":  1
    },
    {
        "durabilityCost":  3,
        "id":  "job-008",
        "repGainSuccess":  5,
        "staminaCost":  2,
        "tier":  1,
        "basePayout":  145,
        "requiredTools":  [
                              "ladder",
                              "drill"
                          ],
        "name":  "Attic Ladder Brace",
        "risk":  0.28,
        "flavor":  {
                       "neutral_line":  "Attic Ladder Brace improved in the emotionally measurable ways.",
                       "success_line":  "Attic Ladder Brace no longer looks experimental.",
                       "client_quote":  "The attic entrance currently negotiates with ankles.",
                       "fail_line":  "Attic Ladder Brace remains interpretive with structural ambition."
                   },
        "districtId":  "residential",
        "tags":  [
                     "roof",
                     "outdoor"
                 ],
        "repLossFail":  2
    },
    {
        "durabilityCost":  3,
        "id":  "job-009",
        "repGainSuccess":  4,
        "staminaCost":  2,
        "tier":  1,
        "basePayout":  138,
        "requiredTools":  [
                              "saw",
                              "hammer"
                          ],
        "name":  "Deck Board Swap",
        "risk":  0.24,
        "flavor":  {
                       "neutral_line":  "Deck Board Swap improved in the emotionally measurable ways.",
                       "success_line":  "Deck Board Swap no longer looks experimental.",
                       "client_quote":  "One deck board squeaks in protest.",
                       "fail_line":  "Deck Board Swap remains interpretive with structural ambition."
                   },
        "districtId":  "residential",
        "tags":  [
                     "outdoor",
                     "framing"
                 ],
        "repLossFail":  2
    },
    {
        "durabilityCost":  2,
        "id":  "job-010",
        "repGainSuccess":  3,
        "staminaCost":  2,
        "tier":  1,
        "basePayout":  98,
        "requiredTools":  [
                              "caulk-gun",
                              "utility-knife"
                          ],
        "name":  "Bathroom Caulk Reboot",
        "risk":  0.17,
        "flavor":  {
                       "neutral_line":  "Bathroom Caulk Reboot improved in the emotionally measurable ways.",
                       "success_line":  "Bathroom Caulk Reboot no longer looks experimental.",
                       "client_quote":  "The tub edge is auditioning for geology.",
                       "fail_line":  "Bathroom Caulk Reboot remains interpretive with structural ambition."
                   },
        "districtId":  "residential",
        "tags":  [
                     "indoor",
                     "seal"
                 ],
        "repLossFail":  1
    },
    {
        "durabilityCost":  3,
        "id":  "job-011",
        "repGainSuccess":  5,
        "staminaCost":  3,
        "tier":  2,
        "basePayout":  175,
        "requiredTools":  [